{
  "pensionSavingsTaxCharges": {
    "isAnnualAllowanceReduced": true,
    "taperedAnnualAllowance": true,
    "moneyPurchasedAllowance": true,
    "pensionSchemeTaxReference": ["00123456RA", "00123456RA"],
    "lumpSumBenefitTakenInExcessOfLifetimeAllowance":
      {
        "amount":100,
        "taxPaid":100
      }
    ,
    "benefitInExcessOfLifetimeAllowance":
      {
        "amount":100,
        "taxPaid":100
      }
  },
  "pensionSchemeOverseasTransfers": {
    "overseasSchemeProvider": [
      {
        "providerName": "name",
        "providerAddress": "address",
        "providerCountryCode": "postcode",
        "qualifyingRecognisedOverseasPensionScheme": [
          "Q123456"
        ]
      }
    ],
    "transferCharge": 100,
    "transferChargeTaxPaid": 100
  },
  "pensionSchemeUnauthorisedPayments": {
    "pensionSchemeTaxReference": ["00123456RA", "00123456RA"],
    "surcharge": {
      "amount": 100,
      "foreignTaxPaid": 100
    },
    "noSurcharge": {
      "amount": 100,
      "foreignTaxPaid": 100
    }
  },
  "pensionContributions": {
    "pensionSchemeTaxReference": ["00123456RA", "00123456RA"],
    "inExcessOfTheAnnualAllowance": 100,
    "annualAllowanceTaxPaid": 100
  },
  "overseasPensionContributions": {
    "overseasSchemeProvider": [
      {
        "providerName": "Overseas Pensions Plc",
        "providerAddress": "111 Main Street, George Town, Grand Cayman",
        "providerCountryCode": "CYM",
        "pensionSchemeTaxReference": [
          "00123456RA"
        ]
      }
    ],
    "shortServiceRefund": 123.0,
    "shortServiceRefundTaxPaid": 123.0
  }
}